{
  "schema_version": "1.0",
  "event_id": "demo-event-001",
  "input_revision": 1,
  "round_id": "demo-round-001",
  "data_origin": "SYNTHETIC_DEVELOPMENT_FIXTURE",
  "status": "NEEDS_EVIDENCE",
  "abstain": true,
  "summary": "本轮输入与上一轮逐字段一致（event_id、input_revision、round_id 均未变化），未收到任何补充证据，因此按原候选重新检查后排名不变，不作确定性根因结论。本输入为手工构造的合成开发样例（SYNTHETIC_DEVELOPMENT_FIXTURE），整体按模拟解释，不来自真实场站或后端实跑。可观察依据：在固定窗 2026-10-28T10:00–10:01Z 内，同属 BUS-B 的两台设备功率同期下降——CP-05 由 96 降至 60 kW（E01），PCS-01 由 180 降至 110 kW（E02）；E02 标注符号约定为放电为正，且明示其数值不构成功率平衡，故本轮不据此做功率平衡或效率核算；E03 仅给出同母线拓扑事实，并声明尚未提供上游电压与调度记录。矛盾与缺口：两点质量虽标为 good，但缺少上游母线电压窗口、调度限功率记录与设备独立时间戳核对，三者均属缺失信息而非反证，无法区分“上游母线电压异常/电网侧扰动”与“上级调度限功率指令”，亦不能排除共用采集链路的同向偏差。下一步：请求读取同窗 METER-01 母线电压这一项只读补证以区分前两项候选，并请人工按厂家与现场规程核对记录与状态。",
  "hypotheses": [
    {
      "hypothesis_id": "H1",
      "rank": 1,
      "cause": "可能：BUS-B 上游母线电压异常（电压跌落或电网侧扰动）使同母线设备同期降低出力（待核验）",
      "support_evidence_ids": ["E01", "E02", "E03"],
      "against_evidence_ids": [],
      "missing_information": ["事件窗内 BUS-B 上游母线/METER-01 电压窗口", "上游保护或扰动动作记录", "CP-05 与 PCS-01 的独立时间戳与对时状态", "站端运行方式记录"]
    },
    {
      "hypothesis_id": "H2",
      "rank": 2,
      "cause": "可能：上级调度或 EMS 下发限功率指令，导致两设备同期降低出力（待核验）",
      "support_evidence_ids": ["E01", "E02", "E03"],
      "against_evidence_ids": [],
      "missing_information": ["调度/EMS 限功率指令记录及其下发时间戳", "指令目标功率与设备实际响应的一致性核对", "人工操作与运行方式记录"]
    },
    {
      "hypothesis_id": "H3",
      "rank": 3,
      "cause": "可能：两台设备共用的采集或通信链路出现同向偏差，使记录功率同期偏低（待核验，次要）",
      "support_evidence_ids": ["E01", "E02"],
      "against_evidence_ids": [],
      "missing_information": ["独立测量或第三方计量比对", "采集链路与对时状态记录", "同窗电压、电流等关联测点是否同步变化", "两点质量标记 good 仅为自述，缺少独立验证"]
    }
  ],
  "requested_evidence": [
    {
      "query_id": "Q01",
      "reason": "Q01 为只读遥测窗口查询，返回当前事件固定时间窗内 METER-01 母线电压，缺失时返回 missing 且不补造读数。它用于区分排名前两位的候选：若同窗母线电压明显异常，则支持 H1（上游母线电压/电网侧扰动）；若母线电压保持正常而两设备功率仍同期下降，则削弱 H1、相对更支持 H2（调度限功率指令）。该证据本身不单独证明任何根因，母线电压正常不能直接证明调度限功率，电压异常也不能排除测量异常，故仅作为候选区分证据。"
    }
  ],
  "human_checks": [
    "由合格人员按厂家与现场规程核对事件窗内调度/EMS 限功率指令记录及其下发时间戳，确认是否存在限功率要求",
    "由合格人员核对 BUS-B 上游母线电压曲线与相关保护、扰动动作记录，确认同窗是否存在电压异常或电网侧扰动",
    "由合格人员核对 CP-05 与 PCS-01 的本地时间戳、对时状态与采集链路记录，确认两点同期下降是否为真实同期事件",
    "由合格人员核对 PCS-01 的功率符号约定与量纲说明，确认 E02 数值是否可直接与 CP-05 比较",
    "由合格人员按现场规程核对两设备实际运行状态与厂家文档，复核上述候选，并确认是否仍有缺失记录待补"
  ]
}
