{
  "schema_version": "1.0",
  "event_id": "demo-event-001",
  "input_revision": 3,
  "round_id": "demo-round-voltage-normal",
  "data_origin": "SYNTHETIC_DEVELOPMENT_FIXTURE",
  "status": "NEEDS_HUMAN",
  "abstain": true,
  "summary": "本输入为合成开发夹具（data_origin=SYNTHETIC_DEVELOPMENT_FIXTURE），所有数值按模拟解释，不代表真实设备状态。可观察事实：同一 1 分钟窗口内 CP-05 功率由 96kW 降至 60kW（E01），PCS-01 由 180kW 降至 110kW（E02），两台设备同属 BUS-B（E03），呈同窗同步下降。E02 自带说明为“正=向母线放电”且两值不构成功率平衡，因此不能用 E01/E02 互校或反推站级功率。E04 为上游站点表示例电压，10:00 与 10:01 均为 400V、质量 good，但其说明明确它是示意性上游表计、并非对 BUS-B 电压的独立验证；故母线电压正常不能直接证明存在调度限功率，电压异常同样不能排除测量异常。当前缺失上游母线电压窗口、调度限功率记录、保护与告警记录以及设备独立时间戳核对，无法区分“共同上级原因”与“各自本地原因”。available_queries 为空且 query_budget_remaining=0，本轮无法请求任何只读补证，因此不作确定性根因结论，仅列出待核验候选并转人工复核，不声称已维修、已现场确认或已恢复。",
  "hypotheses": [
    {
      "hypothesis_id": "H1",
      "rank": 1,
      "cause": "可能为上级调度限功率或站级共享指令导致的同步降功率（待核验）",
      "support_evidence_ids": ["E01", "E02", "E03"],
      "against_evidence_ids": [],
      "missing_information": ["该窗口的调度/限功率指令记录（EMS 或调度日志）", "站级或上游保护与告警记录", "BUS-B 母线电压的独立测量（非 E04 所示的示意上游表计）", "CP-05 与 PCS-01 的独立时间戳核对，确认两处下降确为同一时刻"]
    },
    {
      "hypothesis_id": "H2",
      "rank": 2,
      "cause": "可能为设备级本地原因（本地控制策略、限流或温度降额、本地下发值改变）导致的输出下降（待核验）",
      "support_evidence_ids": ["E01", "E02"],
      "against_evidence_ids": [],
      "missing_information": ["CP-05 与 PCS-01 的本地控制器事件、参数与告警记录", "E03 仅说明两台设备同属 BUS-B，不构成对本候选的明确反证，也无法排除两处独立本地原因同时发生", "设备侧温度、SOC 与限流/降额条件记录", "原始点表量纲与符号约定的核对结果"]
    },
    {
      "hypothesis_id": "H3",
      "rank": 3,
      "cause": "可能为测量链路、计量口径或时间对齐不一致，使功率读值下降表现的物理含义待确认（待核验）",
      "support_evidence_ids": ["E02", "E04"],
      "against_evidence_ids": ["E01"],
      "missing_information": ["METER-01 的校验状态、CT/PT 变比与二次回路核对记录", "BUS-B 电压的独立验证测点，用以确认 E04 的测点归属与口径", "CP-05、PCS-01 采样时间戳与独立时钟（对时）比对结果", "E01/E02 原始报文与点表量纲核对，确认 E02 不构成功率平衡是否影响读数解释"]
    }
  ],
  "requested_evidence": [],
  "human_checks": [
    "按厂家与现场规程查阅并核对该窗口的调度/限功率指令与站级 EMS 运行记录，确认是否存在指令性降功率。",
    "查阅 CP-05 与 PCS-01 在 10:00–10:01 的本地控制器事件、告警与保护动作记录，仅做调阅核对。",
    "核对 BUS-B 母线电压的独立测量结果，确认 E04 所示上游表计的测点归属与口径。",
    "核对 CP-05、PCS-01 与计量表计的独立时间戳与对时状态，确认 E01、E02 是否来自同一时钟源。",
    "核对 METER-01 的校验记录、CT/PT 变比与二次回路检查记录，确认电压读值的计量口径。",
    "核对 E01、E02 对应点表的量纲与符号约定（正=向母线放电），确认功率下降的物理含义。",
    "以上均为记录与状态核对事项，需由合格人员在具备授权与厂家、现场规程支持下完成。"
  ]
}
