{
  "schema_version": "1.0",
  "event_id": "demo-event-001",
  "input_revision": 1,
  "round_id": "demo-round-001",
  "data_origin": "SYNTHETIC_DEVELOPMENT_FIXTURE",
  "status": "NEEDS_EVIDENCE",
  "abstain": true,
  "summary": "本输入为手工构造的合成开发样例（SYNTHETIC_DEVELOPMENT_FIXTURE），按模拟解释，不来自真实场站或后端实跑。在固定时间窗2026-10-28T10:00–10:01Z内，同属BUS-B（E03）的两台设备功率同期下降：CP-05由96降至60 kW（E01），PCS-01由180降至110 kW（E02，符号约定为放电为正，且标注其数值不构成功率平衡，故本轮不做功率平衡核算）。两个测点声明质量为good，E03拓扑事实质量good。同期、同母线的下降提示可能存在共同上游因素，但当前缺少上游母线电压窗口、调度限功率记录与设备独立时间戳核对，无法区分“上游母线电压异常/电网侧扰动”与“上级调度限功率指令”，另存在共同采集链路同向偏差的次要可能。因此仅给出可能/待核验的候选，不作确定性根因结论并请求人工复核；同时请求读取同窗METER-01母线电压这一只读补证，以区分前两项候选。",
  "hypotheses": [
    {"hypothesis_id": "H1", "rank": 1, "cause": "可能：BUS-B上游母线电压异常（电压跌落或电网侧扰动）使同母线设备同期降低出力（待核验）", "support_evidence_ids": ["E01", "E02", "E03"], "against_evidence_ids": [], "missing_information": ["事件窗内BUS-B上游母线/METER-01电压窗口", "上游保护或扰动动作记录", "CP-05与PCS-01的独立时间戳与本地时钟同步状态"]},
    {"hypothesis_id": "H2", "rank": 2, "cause": "可能：上级调度或EMS下发限功率指令，导致两设备同期降低出力（待核验）", "support_evidence_ids": ["E01", "E02", "E03"], "against_evidence_ids": [], "missing_information": ["调度/EMS限功率指令记录及其下发时间戳", "指令目标功率与设备响应的一致性核对", "站端运行方式与人工操作记录"]},
    {"hypothesis_id": "H3", "rank": 3, "cause": "可能：两台设备共用的采集或通信链路出现同向偏差，使记录功率同期偏低（待核验，次要）", "support_evidence_ids": ["E01", "E02"], "against_evidence_ids": ["E01", "E02"], "missing_information": ["独立测量或第三方计量比对", "采集链路与对时状态记录", "同窗其他测点（电压、电流）是否同步变化"]}
  ],
  "requested_evidence": [{"query_id": "Q01", "reason": "Q01为只读遥测窗口查询，返回当前事件固定时间窗内METER-01母线电压；缺失时返回missing且不补造读数。该补证用于区分排名前两位的候选：若同窗母线电压明显异常，则支持H1（上游母线电压异常/电网扰动）；若母线电压保持正常而两设备功率仍同期下降，则削弱H1、更支持H2（调度限功率指令）。它不单独证明任何根因，仍属候选区分性证据。"}],
  "human_checks": [
    "由合格人员按厂家与现场规程核对事件窗内调度/EMS限功率指令记录及其下发时间戳，确认是否存在限功率要求",
    "由合格人员核对BUS-B上游母线电压曲线与相关保护、扰动动作记录，确认同窗是否存在电压异常或电网侧扰动",
    "由合格人员核对CP-05与PCS-01的本地时间戳、对时状态与采集链路记录，确认两点同期下降是否为真实同期事件",
    "由合格人员核对PCS-01功率符号约定与量纲说明，确认E02数值是否可直接与CP-05比较",
    "由合格人员按现场规程核对两设备现场实际运行状态与厂家文档，复核上述候选"
  ]
}
